reviews,search_term,title,location,summary
,Data Engineer,"Sr. Software Engineer, RTB Systems",,"
As well as provide mentorship to other engineers on the team. Ability to partner with architects, developers, systems reliability engineers and DBAs to..."
,Data Engineer,Senior IT Engineer,,"
Senior Engineer (Bay Area). Serve as a point of escalation to level I and II engineers. Demonstrate and model function to new hires and level I and II engineers..."
,Data Engineer,Jr. Programmer Will consider new graduates with programming...,,"
Work under the direction of Software Engineers. Experience with data access technologies - SQL, Web Services, REST, JSON...."
"2,661 reviews",Data Engineer,Node.js Full Stack Engineer,,"
Node.js Full Stack Engineer. Lead and/or mentor a team of engineers. As a Capital One Software Engineer, you'll work on everything from customer-facing web and..."
101 reviews,Data Engineer,Data Scientist - China Growth (ML),,"
Machine Learning Data Scientists on the China Growth Data Science team work closely with product, engineer, marketing and operation teams in China to tackle..."
11 reviews,Data Engineer,Senior Data Engineer,,"
As a Senior Data Engineer, here's what we'll be looking for you to bring:. Proven track record of Innovation and expertise in Data Engineering...."
,Data Engineer,HTML 5 Developer,,"
Understanding of basic image processing algorithms, and ability to manipulate image data on HTML5. Ixonos is a creative technology company with designers,..."
2 reviews,Data Engineer,"Director, Technical Operations and Manufacturing",,"
Exceptional analytical and creative problem solving skills, strong ability to work with complex and detailed data to drive insights and decisions...."
,Data Engineer,Software Engineer,"Fremont, CA",Experience with cloud-based data processing like Hadoop or Spark. We are seeking software engineers with good analytical skills to build a software...
3 reviews,Data Engineer,"UI/UX Director, Ads & Analytics","San Francisco, CA",Passion for data visualization and UI technologies. Your experience working and communicating with a team of Engineers and Product Managers through the entire...
429 reviews,Data Engineer,Staff Data Engineer,"Mountain View, CA","Product Management, Project Management, Data Architects, Data Scientists, Data Analysts, Software Engineers, and other Data Engineers...."
694 reviews,Data Engineer,Application Engineer - Globalization,"San Francisco, CA","*Application Engineer \- Globalization**. + Deep understanding of distributed data model. + Define,evangelize, and roll out globalization best practices \..."
,Data Engineer,Facilities Systems Technician,"Oakland, CA",Enters and retrieves data from District computer programs. Maintains records of UST's and provides required reports to Environmental Engineer and Facility...
23 reviews,Data Engineer,Senior Software Engineer - Data Products,,"
Senior Software Engineer, Data Products. Our Data Products include:. Realtime streaming access to Twitter data...."
,Data Engineer,Backend Engineer,,"
In this role you will have the opportunity to work on multiple projects related to data processing and real-time analytics with systems holding upwards of 10TB..."
8 reviews,Data Engineer,Data Engineering Expert,,"
Seasoned data engineer with experience building data pipelines for streaming / distributed data. Help data scientists optimize their data retrieval queries...."
,Data Engineer,Lead Data Scientist,,"
Employ these models to analyze transaction data on an ongoing basis. Eatsa is looking for a Data Scientist to join our exciting and growing Operations team...."
2 reviews,Data Engineer,Sr. Software Engineer - Messaging,,"
We are seeking engineers who have solved complex problems at scale and have the aptitude to navigate uncharted waters...."
"1,138 reviews",Data Engineer,Big Data Software Engineer,,"
Machine learning on big data. Experience mining insights from social media data set. Very strong hands-on technical experience with Big Data technologies like..."
366 reviews,Data Engineer,"Intern, Web Performance Analytics Engineer Job",,"
Requisition ID: 111967 Work Area: Software-Development Operations Expected Travel: 0 - 10% Career Status: Student Employment Type: Limited Full Time COMPANY..."
399 reviews,Data Engineer,Sr Software Engineer,,"
Experience working with large data sets. Writing, testing and debugging both legacy and new software in multiple languages...."
124 reviews,Data Engineer,"Senior Software Engineer, Data Platform and Services",,"
Software Engineer (Big Data) - Data Platform and Services Cloud. Experience with Java and/or C++ in a Linux/UNIX data center environment...."
,Data Engineer,Signal Processing & Data Analyst,,"
Our team brings together an incredibly diverse and multidisciplinary set of backgrounds and skills – from electrical and mechanical engineers, to physicists,..."
2 reviews,Data Engineer,Big Data Software Engineer - Hedge Funds,"San Francisco Bay Area, CA","Big Data Software Engineer - Hedge Funds - trading, portfolio management and analytics platform. We are seeking talented senior level software engineers to join..."
31 reviews,Data Engineer,Big Data Engineer/ Senior Data Engineer,"San Francisco, CA",Big Data team is looking for an experienced Data Engineer who has a passion to build data products and data systems....
429 reviews,Data Engineer,Principal Software Engineer (Big Data),"Mountain View, CA","Data engineering, data science, and data products - internally and externally; We build awesome data products:...."
44 reviews,Data Engineer,Senior Software Engineer - Maps and Search,"San Francisco, CA",Senior Software Engineer - Maps and Search. Familiarity with building/deploying web services and data pipelines in AWS....
41 reviews,Data Engineer,Full Stack Engineer,"Berkeley, CA","Python - to manage the flow of real-time and summary data on the backend. HTML, CSS, Javascript, openlayers - to build dynamic GUIs for the colleagues..."
78 reviews,Data Engineer,Staff Software Engineer,"San Jose, CA",Mentor junior and senior engineers. We are looking for a dynamic individual to lead a team of seasoned and senior engineers in the design and development of L2...
,Data Engineer,DevOps Engineer,,"
We track thousands of data elements every month, from national factors down to house-level data. Our databases are constantly expanding - great data is required..."
5 reviews,Data Engineer,"Software Engineer, Data Systems",,"
Large-scale data ingestion and integration – design, implement scalable ETL processes to collect and store large amount of data from multiple data centers and..."
883 reviews,Data Engineer,Cloud Performance Engineer / Architect: Oracle Public Cloud,,"
Experience with Latest Open Source Cloud Technologies - Big Data (Spark, Hadoop), Cassandra, Mesos, Kubernetes, Kafka NoSql, Docker, etc...."
,Data Engineer,Director of Quality Assurance,,"
Execute architecture and engineering plans for the storage and data network platforms. Manage the day to day activities of a team of experienced Software..."
,Data Engineer,Customer Support - Business Process Analyst,,"
Cloudera delivers the modern data management and analytics platform built on Apache Hadoop and the latest open source technologies...."
,Data Engineer,Software Engineer - University Grad,,"
Recent grads in the past have built a real-time high-throughput data processing pipeline that ties our infrastructure together, built out our proprietary..."
124 reviews,Data Engineer,"Software Engineer, Internal Capacity Engineering",,"
Knowledge of Big Data technologies (e.g. Experience with enterprise performance testing and data analysis. Software Engineer, Internal Capacity Engineering,..."
,Data Engineer,Senior Software Engineer - LIMS,,"
As a Senior Software Engineer - Applications at Twist, you will be working with our R&D, operations, informatics, and e-commerce teams to build and enhance both..."
4 reviews,Data Engineer,Senior Big Data Engineer,,"
Senior Big Data Engineer. You will be a key part of the design, architecture and building of a data platform over Big Data technologies...."
,Data Engineer,Software Engineer,,"
Back End Engineer. Solid algorithms and data structures background. 5+ years of professional experience working as a back end engineer...."
294 reviews,Data Engineer,"Senior Software Engineer - Embedded Communications - Relocation to Cedar Rapids, IA",United States,"May lead a small team of software engineers. We are currently searching for a Senior Software Engineer to join our team in Cedar Rapids, Iowa...."
,Data Engineer,Data Engineer,"San Francisco, CA","and grow your career. Autonomy, flexibility and a flat corporate structure. Plum is leading the transformation of commercial real estate lending through"
,Data Engineer,Senior Front End Engineer,"Millbrae, CA","Collaborate with Back-End API Engineers to define data contracts. Experience with client-side scripting, and data- and event-driven interfaces...."
127 reviews,Data Engineer,Application Operation Engineer,"San Francisco, CA","You consider data consistency and availability tradeoffs when designing systems. As an Application Operation Engineer, you’re curious, with deep technical..."
3 reviews,Data Engineer,Generalist Software Engineer,"San Francisco, CA",We are now searching for a Generalist Software Engineer to help our team shape ideas into an elegant and functional solution....
,Data Engineer,Full Stack Engineer,,"
Strong background with data structures and algorithms (CS/Mathematics degree). Our client's full stack engineers are expected to work across their tech stack...."
53 reviews,Data Engineer,Senior Data Engineer,,"
The Data Engineer should be no stranger to high-scale systems with complex data models and large amounts data coming form various sources...."
101 reviews,Data Engineer,"Data Scientist, Operations",,"
A graduate degree in statistics, computer science, engineering or a quantitative domain 1-5 years of data science experience Experience in diverse data science..."
,Data Engineer,Data Annotation Engineer,,"
Annotate media such as videos and other forms of data used for training state of the art machine learning algorithms. What You Will Do*...."
,Data Engineer,Software Engineer,,"
You'd join as the third engineer and would own the frontend dashboards and related APIs. Beyond the core infrastructure, you'd have the freedom to explore new..."
,Data Engineer,Senior Backend Engineer - Data Team,,"
InfoScout is looking for a senior engineer to join our Data Engineering team. Data Warehouse - Optimize our Vertica data warehouse (a MPP columnar database) for..."
,Data Engineer,Software Engineer - Generalist,,"
The engineers we are looking for have these traits in common:. Front-end software engineers and product folks to continuously improve our core product...."
,Data Engineer,"Engineer, Full Stack (Personalization)",,"
Work with our production team to analyze and interpret this data using data warehousing solutions. Personalization engineer is one of our most exciting..."
,Data Engineer,Full Stack Engineer,,"
Work with our data engineers, data scientists, product managers and designers to create great interactive tools and visualizations that deliver insights from..."
,Data Engineer,Analytics and Tools Engineer,,"
We do all design and development in-house, from PCB design to embedded software, data analytics to mobile apps...."
15 reviews,Data Engineer,"Staff Software Engineer, Publisher Framework (Spark and HBase Microservices)","San Francisco, CA","Mentor junior software engineers. Experience building intensive data driven applications. Experience developing distributed systems, especially data stores...."
,Data Engineer,Customer Success Engineer,"Redwood City, CA","Research, resolve, and record all levels of software questions from customers, support teams to gather data and communicate status of customer issues\*...."
3 reviews,Data Engineer,Backend Engineer - Unity Ads,"San Francisco, CA",Ensure service scalability through effective code and data storage design. Understanding of how different data storage engines work and what are the limitations...
,Data Engineer,Operations Engineer,"San Mateo, CA",Work closely with Application Engineers to design and execute data upgrades to our test and production databases....
2 reviews,Data Engineer,DevOps Software Engineering,"Sunnyvale, CA",Have experience in SAS-70 or SOC-certified commercial data centers. Have experience in public key or financial or healthcare data centers....
127 reviews,Data Engineer,Application Operation Engineer,,"
You consider data consistency and availability tradeoffs when designing systems. As an Application Operation Engineer, you’re curious, with deep technical..."
13 reviews,Data Engineer,"Intern, California Clean Energy",,"
Ability to understand and interpret building energy use data and associated analyses. Ability to understand and analyze environmental data, including emissions..."
17 reviews,Data Engineer,Senior Back-End Engineer - Data Services,,"
We're looking for a data engineer to work with us as we continue to expand our data infrastructure with new capabilities...."
,Data Engineer,Data Analytics Engineer at AsperaLabs,,"
The Data Engineer position will focus on big data architectural problems in the Hadoop ecosystem. Container-izing these data pipelines for deployment...."
,Data Engineer,Software Engineer,,"
In collaboration with product managers and team lead, our front end software engineers work to deliver data to the browser and capture user interaction in a..."
97 reviews,Data Engineer,Software Engineer - New Grad,,"
Full Stack Engineer. Strong grasp of algorithms and data structures; Our Search & Data Mining, Ads and Spam Prevention teams see tens of millions of Yelp..."
,Data Engineer,"Program Manager, Data Team",,"
As the Program Manager of the Data team, you'll be working closely with Data Analysts, Product Managers, Marketers, and others across the organization to..."
196 reviews,Data Engineer,Webservices Developer-- Next Generation Products,,"
Review code from other engineers. We're the ones behind the gorgeously designed content that streams across your laptop, TV, phone, and tablet every day—and we..."
4 reviews,Data Engineer,"Senior Engineer, Big Data",,"
As a member of the data & analytics team, you will work closely with data engineers, analysts, and data scientists to develop novel systems, algorithms, and..."
44 reviews,Data Engineer,Senior Big Data Engineer,,"
Ingested large amount of raw data (web logs, web pages, data feeds). Trulia’s unique position within Zillow Group provides advantages for engineers who want to..."
2 reviews,Data Engineer,Forward Deployed Engineer,"Mountain View, CA",Forward Deployed Engineer - Portland. The ability to work closely with other engineers in a DevOps environment....
31 reviews,Data Engineer,Big Data Engineer/ Senior Data Engineer,"San Francisco, CA",Big Data team is looking for an experienced Data Engineer who has a passion to build data products and data systems....
,Data Engineer,Data Engineer,"San Francisco, CA","and grow your career. Autonomy, flexibility and a flat corporate structure. Plum is leading the transformation of commercial real estate lending through"
"1,184 reviews",Data Engineer,Sr Engineer,"Milpitas, CA",Ability or aptitude to work on problems that are complex in scope where analysis of situations or data involves multiple competing factors;...
,Data Engineer,Software Engineer,,"
MS in EE or CS2-3 years of industry experienceC/C++, Python, BashOOP, Data structures, pointers, libraries (poco, lapack, …), networkingProfiling (kcache,..."
,Data Engineer,Software Engineer - Growth,,"
Being an engineer means:. Every single engineer is making a huge impact on our customers and company’s growth...."
,Data Engineer,Bioinformatics Pipeline Development and Support Engineer,,"
These individuals will design and implement data analysis pipelines, databases, analysis tools, and web user interfaces for large-scale genetic data sets...."
,Data Engineer,Bioinformatic Analyst,,"
Experience with algorithms and pipelines to analyze genotyping and sequencing data. The successful candidate will also be responsible for working with software..."
,Data Engineer,Senior Back-End Engineer,,"
Replicating and sharding multiple data storage systems. Data modeling to optimize for performance based on access paths...."
,Data Engineer,Business Systems Analyst,,"
Data and data management requirements for SAC’s data processes and systems. 3+ years requirements development experience directly related to software..."
,Data Engineer,Lead Technical Trainer,,"
Docker’s mission is to remove the inefficiencies in the daily lives of engineers and sysadmins alike and make room for more creativity and innovation...."
,Data Engineer,Adobe CQ/AEM Developer,,"
Experience collaborating with clients, project managers, and engineers. Comfortable with data exchange protocols like JSON and XML. Skills And Experience*...."
,Data Engineer,Full Stack Engineer,,"
We are looking for a talented full stack engineer driven by the pride and satisfaction of building something end to end...."
24 reviews,Data Engineer,Growth Engineer,,"
Data driven and passionate about measuring things and working with data. As the Growth Engineer, you’ll join a small team and collaborate with Product Managers,..."
127 reviews,Data Engineer,Data Scientist,"San Francisco, CA",As a Data Scientist at Indeed your role is to follow the data. Can fish for data:. How A Data Scientist Works. Can do small data modeling work:....
,Data Engineer,Data Engineer,"Menlo Park, CA",Our client is looking for a Data Engineer for contract role. Python ETL AWS Postgres Data Warehouse Startup Background in-person interview is must local...
429 reviews,Data Engineer,Staff Software Engineer (Data Governance),"Mountain View, CA","We're looking for a solid Software Engineer who possesses excellent technical skills to work with the team in the areas of Data Mining, Data Quality, Data..."
,Data Engineer,Computer Support / Data Recovery Engineer,"Novato, CA","Performing data recovery. DriveSavers Data Recovery, Inc. Is the worldwide leader in data recovery services and provides the fastest, most secure and reliable..."
6 reviews,Data Engineer,Database Engineer,"San Mateo, CA","Data Warehousing exposure. Experience optimizing data models and database schemas, and SQL for distributed applications...."
,Data Engineer,Senior Automation Engineer,,"
Excellent scientific computation and data analysis capabilities. The Twist Bioscience platform has the potential to greatly accelerate the development of..."
,Data Engineer,Senior Data Engineer,,"
Implementing data visualization dashboards. Expertise in modern data engineering, from relational to nosql to big data (streaming and batch)...."
4 reviews,Data Engineer,Software Engineer I,,"
Design object data models to represent complex application data. Software Engineer I (Multiple Openings). San Francisco, California...."
,Data Engineer,Software Engineer - TellApart (Platform Infrastructure),,"
Software Engineer (Platform Infrastructure). Every production system we've ever built feeds into the data platform (where we have PB's of batch-processed data..."
"1,192 reviews",Data Engineer,Mechanical Engineer,,"
Previous data center/mission critical facility,. The engineer will be responsible for providing system design:...."
,Data Engineer,"Software Engineer, Trust & Safety",,"
Build technologies spanning large scale data processing, clustering and data mining. 3+ years of experience in data analysis and statistical modeling...."
,Data Engineer,Systems Engineer - Internal Systems,,"
Experience with analytics data pipelines. The role will touch a diverse set of complex projects such as analytics, entitlements, financial systems, data..."
17 reviews,Data Engineer,IT Operations Support Admin V,,"
Assist in the transition of data between systems on multiple platforms. Interface with users, engineers, and other analysts to meet the needs of the department...."
,Data Engineer,Data Integration Specialist,,"
Data Management Layer. Data manipulation and analysis with tools like Python and Shell scripting. As a senior backend engineer you will own one or more..."
678 reviews,Data Engineer,Principal Engineer,,"
Experience working with location data (latitude/longitude), Elastic Search and push notifications is a big plus...."
6 reviews,Data Engineer,Software Engineer - Analytics,"San Mateo, CA",To be working in a team of smart/talented engineers who are building a big data platform that will be scalable in to the petabytes of data....
127 reviews,Data Engineer,Engineering Manager - San Francisco,"San Francisco, CA","Full stack engineer, Manager:. You understand how to use data to make decisions. Solid knowledge of data structures and algorithms and excellent programming..."
6 reviews,Data Engineer,Software Engineer,"Redwood City, CA","3+ years of experience as a software engineer. Coordinate with cross-functional groups in Product Development, R&D, and Data Management to prototype and..."
429 reviews,Data Engineer,"Senior Software Engineer, Big Data","Mountain View, CA","The Intuit Data Engineering Analytics team, or IDEA, provides and uses data to help our customers and Intuit make and save money...."
,Data Engineer,Data Engineer,"San Francisco, CA","and grow your career. Autonomy, flexibility and a flat corporate structure. Plum is leading the transformation of commercial real estate lending through"
24 reviews,Data Engineer,Software Engineer - Licensing and Virtualization Platforms,,"
Strong verbal and written communication skills to interact with engineers & management in technical forums. Location-independent computing turns location and..."
,Data Engineer,Entry Level Software Engineer,,"
Software Engineers looking to land their dream job. Data structures, recursion, dynamic programming, time/space complexity, algorithms, and systems design...."
4 reviews,Data Engineer,Senior Data Science Engineer,,"
Experience with manipulating large data sets. Engineer to put your research into practice. We like to think of Data Science Engineering as a ""startup within..."
101 reviews,Data Engineer,Engineering Manager - Realtime Data Processing (Marketplace...,,"
This is an opportunity of a lifetime for someone who wants to lead an enterprising group of engineers in a hyper-growth company tackling increasing volume of..."
101 reviews,Data Engineer,Software Engineer - Large-Scale Data Mining,,"
We are looking for a seasoned engineer to help work together with the research team to build the scalable infrastructure for large-scale data mining...."
129 reviews,Data Engineer,"Sr. Manager, Collaboration and Data Management Strategy",,"
Manager, Collaboration and Data Management Strategy/16WD20815. Manages the daily business for collaboration and data management offerings;..."
,Data Engineer,image/ video quality analyst,,"
The work will entail capturing data in a variety of environments and compiling test reports. The Image Tuning Test Engineer will be responsible for ensuring the..."
,Data Engineer,Senior Software Engineer,,"
Develop tools to support internal data analysis and R&D. Background in analysis and visualization of geospatial data a plus...."
23 reviews,Data Engineer,Software Engineer - TellApart (Platform Infrastructure),,"
Software Engineer (general requirements):. Every production system we've ever built feeds into the data platform (where we have PB's of batch-processed data..."
129 reviews,Data Engineer,Principal DevOps Engineer,,"
Principal DevOps Engineer. Solid understanding of application data flow and how it meets system infrastructure...."
"1,980 reviews",Data Engineer,"Software Engineer, Mobile Development & Research, Palo Alto","Palo Alto, CA","Embedded/device systems, third party libraries for iOS, automated testing frameworks such as UI automation, mobile optimized websites and mobile web browsers..."
3 reviews,Data Engineer,Senior Software Engineer (Cross-Platform),"San Francisco, CA","The Cross-Platform Engineer will be an integral part of the Unity Analytics team in San Francisco, developing and maintaining the instrumentation and data..."
31 reviews,Data Engineer,Big Data Engineer/ Senior Data Engineer,"San Francisco, CA",Big Data team is looking for an experienced Data Engineer who has a passion to build data products and data systems....
,Data Engineer,BIg Data Engineer,"San Francisco, CA",Should be passionate about building innovate data products and turning raw data into high quality actionable data....
,Data Engineer,Software Engineer,"San Francisco Bay Area, CA","(You understand smart pointers, templates, and a wide variety of data structures. We are scouting for a Software Engineer for our Cameras/3D Modeling Team...."
,Data Engineer,Process Engineer (CGMP Pharmaceutical Manufacturing),,"
Responsibilities of the Process Engineer (CGMP Pharmaceutical Manufacturing). We are assisting our Client, an innovative high growth leader, Process Engineer..."
,Data Engineer,Data Annotation Engineer,,"
As our Sample Data Annotation Engineer, you will collect and prepare media and sample data for training machine learning algorithms...."
5 reviews,Data Engineer,Product Security Specialist,,"
Advise engineers and teams on security issues; Work on new product features to make Dropbox users and data more secure...."
,Data Engineer,Staff Database Engineer,,"
Develop strategies to scale out MySQL deployments in multiple data centers. You will be part of a tight knit team of experienced database engineers...."
