reviews,search_term,title,location,summary
13 reviews,Data Engineer,"Data Scientist, Growth",,"
Work with engineers to evangelize data best practices and implement analytics solutions. As a Data Scientist at Square you will lead projects that derive value..."
,Data Engineer,Software Engineer - Data Privacy,,"
Engineers and Technicians Analysis, API, Architecture, Cryptography, Data Analysis, Database, Development, Encryption, Hadoop, iOS, JavaScript, Mobile..."
"8,217 reviews",Data Engineer,Mobile Software Engineer influencing millions of passionate...,,"
Computer Science fundamentals in object-oriented design, data structures and algorithm design, and complexity analysis...."
,Data Engineer,DevOps Engineer,,"
3+ years of experience as a DevOps Engineer, Systems Administrator, Site Reliability Engineer, or similar. You will work closely with experts in data science,..."
,Data Engineer,Senior Automation Engineer,,"
Use SQL to setup test data. As a Senior Automation Engineer you will:. We leverage technology and data to drive unmatched financial results for borrowers and..."
,Data Engineer,Platform Engineer,,"
You believe in declarative schemas, structured data, and API contracts. You are detail oriented, highly analytical, and can easily hold details and data in your..."
24 reviews,Data Engineer,Software Engineer Network Integration,,"
Riverbed is actively seeking Software Engineers to help build the next generation of software-defined networking infrastructure...."
2 reviews,Data Engineer,Software Engineer in Test,,"
Practice Fusion connects doctors, patients and data to drive better health and save lives. We are looking for a talented Software Engineer in Test who enjoys..."
,Data Engineer,Solar Engineer Drafter,"Berkeley, CA","Coordinate the collection of data and incorporate information from Project Engineer and Design Engineer into drawings, schematics, and maps...."
,Data Engineer,Cloud Engineer,"Mountain View, CA",Professional success building large-scale API systems alongside big data analysis. You will get the opportunity to entertain ideas from experts at the nexus of...
,Data Engineer,Software Engineer,"Livermore, CA",Software Engineer Responsibilities*. Software Engineer Other Skills*. Support software development of radar systems to include design and implementation of data...
6 reviews,Data Engineer,Software Engineer - Analytics,"San Mateo, CA",To be working in a team of smart/talented engineers who are building a big data platform that will be scalable in to the petabytes of data....
,Data Engineer,Computer Vision Engineer,,"
We’re talking hundreds of terabytes of multi-modal sensor data collected by our proprietary platform. Researchers can design, run, and analyze experiments that..."
,Data Engineer,Web Engineer,,"
Build tools to visualize complex student and class data to highlight useful insights. That’s why we’re building an operating system that helps schools use data..."
3 reviews,Data Engineer,Big Data Senior Software Engineer,,"
Big Data Senior Software Engineer. Machine learning on big data. Experience mining insights from social media data set...."
,Data Engineer,Senior Full Stack Engineer,,"
The're looking for an exceptional Full Stack Engineer to join their experimental labs team*. As the primary engineer, you will rapidly build new products from..."
3 reviews,Data Engineer,Data QA Analyst,,"
Ensure data accuracy by validating data, identifying missing data and applying fixes via scripting and manual cleanup...."
,Data Engineer,Software Engineer I,,"
Interact with research and clinical scientists to understand scientific data workflows and support data integration, analytics, visualization and reporting...."
,Data Engineer,"Senior Software Engineer, Models & Data Store",,"
Good understanding of data stores. You will help implement and scale services that build our data models and algorithms that enable our clients to find insights..."
,Data Engineer,Senior software engineer - Big Data,,"
Qualifications - Bachelor of Science degree or equivalent in Computer Science, Computer Engineering, Electrical Engineering or a related field plus 7-10 years"
,Data Engineer,Growth Engineer,,"
Run A/B test to collect/pull data for in-depth analysis. We’re searching for a passionate engineer who’s excited about A/B testing and moving the needle on key..."
"3,509 reviews",Data Engineer,"Director, Clinical System Engineering - Berkeley, CA",,"
Leads and manages the team of Clinical System Engineers. Responsible for ensuring clinical data is supported, protected, and is integrated into Kaiser EMR..."
6 reviews,Data Engineer,Database Engineer,"San Mateo, CA","Data Warehousing exposure. Experience optimizing data models and database schemas, and SQL for distributed applications...."
,Data Engineer,Facilities Systems Technician,"Oakland, CA",Enters and retrieves data from District computer programs. Maintains records of UST's and provides required reports to Environmental Engineer and Facility...
6 reviews,Data Engineer,Software Engineering Manager in Test,"San Mateo, CA",Analyzes test data and provide feedback for making process improvements. Build an A-team of Software Engineers in Test to deliver a high quality product....
reviews,search_term,title,location,summary
,Data Analyst,Database Analyst,"San Francisco, CA",Our production voice network is spread between 10 strategic locations in 5 different countries. You will also assist in extracting and analysing key data from...
31 reviews,Data Analyst,Segmentation Analyst - Marketing Analytics,"San Francisco, CA","Keep a constant eye out for potential improvements in analytics processes, data quality and data sources/tools...."
310 reviews,Data Analyst,Data Scientist (Epidemiology & Health Economics Focus),"Pleasanton, CA","Develops analysis specifications in partnership with Data Analysts. Good understanding of research and commercial real-world data sources, national and regional..."
10 reviews,Data Analyst,Data Analyst,,"
1-2 years experience in data analyst role, preferably working closely with product teams. We’re looking for a data analyst who is passionate about applying..."
6 reviews,Data Analyst,Data Analyst Intern - Recent Grad Opportunity,,"
As a Data Analyst Intern, you will be working on ad hoc requests from our game studios and other central functions. Glu Mobile (NASDAQ:...."
,Data Analyst,Data Analyst,,"
Dive into data to illuminate trends and answer big questions about our users. Our data team works with a mix of MySQL, Postgres, Python, R, Excel, Tableau, and..."
64 reviews,Data Analyst,ERP Business Analyst,,"
Ability to troubleshoot and diagnose using SQL, Excel or other data analysis tools. Ubisoft, a global leader in the video games and entertainment software..."
4 reviews,Data Analyst,Data Analyst,,"
Segment is looking for a data analyst who’s excited to take the massive amount of product and business data at Segment and translate that into useful insights..."
,Data Analyst,Customer Success Operations Analyst/Manager,,"
Evaluate data and systems dependencies to develop project plans with clear definitions for success metrics, timelines, and project team...."
41 reviews,Data Analyst,Junior Data Scientist,,"
Junior Data Scientist. ZipRealty’s Performance & Intelligence Team is looking for aspiring data geeks...."
8 reviews,Data Analyst,BI Analyst,,"
As a Business Insights Analyst, you will provide data and recommendations to the business. Surface and analyze data to help us build more robust Customer..."
234 reviews,Data Analyst,"Rate Data Analyst, Associate",,"
Experience is collecting data from various data sources with different data platforms. SAS programming skills include data handling, statistical and/or..."
2 reviews,Data Analyst,Data Analyst,,"
As a data analyst at Smule, you will convert business questions into actionable insights to help drive business directions...."
"6,038 reviews",Data Analyst,Entry Level Data and Operations Analyst,"Menlo Park, CA","Influencing business teams with data driven recommendations and. Plus-Ability to take raw data, and produce actionable insights...."
127 reviews,Data Analyst,Data Scientist,"San Francisco, CA",As a Data Scientist at Indeed your role is to follow the data. Can fish for data:. How A Data Scientist Works. Can do small data modeling work:....
,Data Analyst,Data Analyst - Pharma/Biotech W2 ONLY,"San Francisco, CA",Data Analyst - Pharma/Biotech W2 ONLY 12 Month Contract. Validate and model data from internal and external sources in support of Strategic Business Analysts...
7 reviews,Data Analyst,Collateral Operations Analyst (Contract),"San Francisco, CA",Provide on-going support for member’s data files and maintenance of data maps. Support changes to the Bank’s member data requirements....
,Data Analyst,Junior Analyst/Research Assistant,,"
Help maintain databases and perform data pulls from Access. Keen attention to detail and pride in producing the highest quality work...."
8 reviews,Data Analyst,Data Analyst I,,"
The Data Analyst I performs quantitative and qualitative analysis of healthcare and financial data and develops reporting solutions, analytic methodologies,..."
5 reviews,Data Analyst,Data Analyst,,"
We are seeking an experienced Data Analyst who combines an intense curiosity about data with a strong commitment to practical problem solving for business..."
,Data Analyst,Commercial Health Data Analyst,,"
We are seeking a talented individual for an Intermediate Analyst role, supporting Account Managers and Analysts / Data Scientists / Consultants in producing..."
3 reviews,Data Analyst,Data Analyst,,"
Support a group of multi-disciplinary data professionals and analysts. Stay current with developments within CRM domain & data management...."
26 reviews,Data Analyst,Associate Analyst,,"
Perform data investigations, analyzing large amounts of data, researching changes in trends, preparing spreadsheet reports and power point slide presentations...."
2 reviews,Data Analyst,Business Data Analyst,,"
Excellent communication and technical skills are critical to access information from various data sources for structured and non-structured data...."
,Data Analyst,Analyst,,"
Management teams make more informed business decisions through access to our industry analysts, best practice research, benchmark data, peer networks, events..."
66 reviews,Data Analyst,Associate Financial Systems Analyst,,"
Ability to understand and interpret financial data, transactions and business processes. Establishing, developing and maintaining a data governance structure..."
,Data Analyst,Data Analyst,,"
We're seeking a passionate Data Analyst to help continue building the most powerful dataset in real estate. Our databases are constantly expanding - great data..."
3 reviews,Data Analyst,Data Scientist,"Redwood City, CA","5+ years of work experience, preferably as data scientist or in highly analytical role. Work closely with product managers and analysts to understand key..."
,Data Analyst,Database Analyst,"San Francisco, CA",Our production voice network is spread between 10 strategic locations in 5 different countries. You will also assist in extracting and analysing key data from...
44 reviews,Data Analyst,Quantitative Analyst,"San Francisco, CA",Experience with Big Data tools such as Hive/Presto. 3-5 years of experience working with data and performing analysis....
,Data Analyst,Outcome-Driven Innovation Market Research Analyst,"San Francisco, CA",The ODI Research Analyst is an important role on our client project teams; Strategyn is seeking an experienced Research Analyst to conduct our outcome-based...
,Data Analyst,Data and Policy Analyst - Statistical Programmer,"Burlingame, CA","Data and Policy Analysts perform a wide array of functions as part of the research process. At Acumen, LLC / The SPHERE Institute, Data and Policy Analysts..."
,Data Analyst,Data Business Analyst,,"
Evaluates data gathered. Business analyst and/or Project management experience. Approaches, data interpretation, and results measurements are employed...."
37 reviews,Data Analyst,Associate Analytics Consulting,,"
The analyst will leverage these data and insights to help enhance market intelligence and facilitate more robust interpretations and understanding of Epocrates’..."
,Data Analyst,Data Scientist,,"
Apply your expertise in quantitative analysis, data mining and data visualization to understand how our users interact with our product...."
124 reviews,Data Analyst,Business Intelligence Analyst,,"
Manage regular data uploads to refresh the databoard data. The analyst will gain in-depth knowledge of the business and translating the data for various data..."
,Data Analyst,Data Scientist,,"
Experience working with large amounts of data. Hands on experience working with large amounts of real data...."
,Data Analyst,"Data Analyst, Growth Marketing",,"
2 years of data analyst experience required. We’re looking for an ambitious analyst who will bring data expertise to a growth team that’s hellbent on bringing a..."
678 reviews,Data Analyst,Pricing and Fees Jr Analyst,,"
The ideal candidate will have a strong academic record in a quantitative discipline, demonstrable attention to detail, and an interest in marketplace dynamics...."
,Data Analyst,Search Analyst,,"
Position: Search Analyst Duration: 8+ months Location: San Francisco, CA * Ability to handle large data sets * Advanced Excel skills. * *Dashboard..."
4 reviews,Data Analyst,Business Analyst,,"
We are seeking a Senior Business Analyst with strong analytical skills and a deep understanding of business strategy to produce solid data analysis, effectively..."
,Data Analyst,Sales Operations Analyst,,"
Approach organization wide problems analytically to come to a data driven resolution. Data driven - we're an analytics company and so we live and breathe by..."
127 reviews,Data Analyst,Data Scientist,"San Francisco, CA",As a Data Scientist at Indeed your role is to follow the data. Can fish for data:. How A Data Scientist Works. Can do small data modeling work:....
,Data Analyst,IT Data and Reporting Analyst,"San Francisco, CA","The Data and Reporting Analyst will design, develop programs and provide complex queries, reports and data extracts in a Microsoft centric environment to meet..."
11 reviews,Data Analyst,Data Scientist,"Santa Clara, CA",Writing or modifying data pipelines to process and mine historical Surveyor data. Experience dealing with large amounts of unstructured data (experience with...
,Data Analyst,Analyst,"San Francisco, CA","This may include working the finance and accounting team for financial data, analyzing the data and incorporating them into presentation materials...."
18 reviews,Data Analyst,Business Analyst,"San Francisco, CA",The Business Analyst possesses the ability to lead and influence stakeholders in refining requirements and implementing new features for GGU's applications....
,Data Analyst,Media and Business Analyst,"San Francisco, CA",Analyze media and response data looking for ways to optimize. Investigate all data and response anomalies by working with key members of the acquisition team....
,Data Analyst,Data Scientist - Discovery Science,,"
Experience with web scale data and big data systems (e.g. Combine crowd-sourced evaluation data and user activity data to define how we measure relevance across..."
7 reviews,Data Analyst,"Data Analyst, Platform",,"
We're looking for data analysts to work on our Platform team. As a data analyst on platform you will drive informed decisions on core systems like:...."
,Data Analyst,Data Analyst,,"
Ipsy is looking for an enthusiastic Data Analyst to join our Analytics team. Excellent SQL and data warehouse skills...."
93 reviews,Data Analyst,Database Marketing Analyst,,"
The Database Marketing Analyst will be responsible for analyzing direct marketing campaigns to identify revenue generating segments and optimizing our existing..."
,Data Analyst,Data Analytics Engineer,,"
Utilize multiple available data sources to create a process to validate asset data consistency across multiple system databases...."
,Data Analyst,Business Data Analyst/SQL Artist,,"
Tableau or data visualization tool expertise. Ability to tell a story (preferably with data). Curious, Passionate People with Strong SQL, Python, and analytic..."
"3,509 reviews",Data Analyst,Consulting Data Analyst,,"
Tests and maintains data integrity. This position functions both as an analyst and as a statistical analytics programmer...."
,Data Analyst,Data Analyst,,"
Data Analyst/ Data entry. Processes notes by reviewing data for deficiencies; Prepares source data by reviewing web sites, and noting certain information about..."
13 reviews,Data Analyst,People Data Analyst,,"
Data visualization tools (e.g. Passion for creating beautiful, intuitive data visualizations. Establish processes and documentation to ensure People data..."
12 reviews,Data Analyst,Data Analyst/Predictive Modeler,,"
Support Data Infrastructure :. Data Integrity, Quality & ETL :. Maintain the quality & integrity of data sources...."
,Data Analyst,Fiber Analyst,"San Francisco Bay Area, CA",Providing full analysis on fibre network data. Understand and fully interpret Chromatic Dispersion and Polarization Mode Dispersion data....
10 reviews,Data Analyst,"Analyst, Marketplace","San Bruno, CA",Ecommerce data analytics experience. Analyzes website data and provides insights. The Analytics Analyst will gather and analyze data to solve complex problems...
4 reviews,Data Analyst,Data Analyst (Banking),"Redwood City, CA","Understanding of relational database and data integration tools. Provides analysis and input on data compiled, as appropriate...."
,Data Analyst,Senior Energy Data Analyst,"Oakland, CA",The Senior Energy Data Analyst will apply data mining and statistical analysis expertise to sophisticated energy data analysis....
,Data Analyst,Product Data Analyst,,"
Analyst, Data Science, Statistics, Product Development, Business Intelligence.*. BI Analyst or Product Management experience...."
,Data Analyst,Data Scientist,,"
Direct Client!!! Role: Data Scientist Location: Bay Area, CA Duration: Till end of the year Interview mode: Phone + Skype Required Skills:  *"
,Data Analyst,"Data Analyst Scientist, Informatics",,"
Present data in standard, meaningful ways incorporating an assessment of the quality of the data and comparisons among methods, data sets, and conditions so..."
124 reviews,Data Analyst,"Analyst, Pipeline Sales Strategy",,"
Analyst, Pipeline Sales Strategy. We are currently seeking an Analyst for the GTM Strategy & Operations team to join the Pipeline Strategy team...."
11 reviews,Data Analyst,Data Scientist,,"
You’re a data enthusiast and a data skeptic; The Team You can’t wait to join a team of data scientists, data engineers, and data visualization experts and make..."
,Data Analyst,Search Analyst/Data Analyst,,"
Search Analyst/Data Analyst*. Experience handling large data sets and preparing data for testing and analysis...."
254 reviews,Data Analyst,"College Global Insights Data Analyst, Data Science",,"
The Global Insights Data Analyst (GIDA), Data Science is responsible for leveraging structured & unstructured consumer data along with other data sources to..."
,Data Analyst,Data Quality Analyst,,"
Data Quality Analyst. Experience with Contact Data Quality, Address Data Quality, Multi-byte data cleansing. Experience using Informatica Data Quality, Trillium..."
,Data Analyst,Business Intelligence Analyst,,"
Source data, transform data and build visualization. The BI Analyst will also go on to source data from a variety of sources and transform data using tools...."
304 reviews,Data Analyst,Sales Data Insights Analyst III,,"
Years of data analysis, data visualization, and insight development. Sales Insights Data Analyst plays a pivotal role in the success of our top tier...."
"3,509 reviews",Data Analyst,Business Analyst,"Oakland, CA",Data / reporting application knowledge for the purpose of aggregating data and converting data into usable formats and patterns....
32 reviews,Data Analyst,Variable Compensation Analyst - Temporary to Permanent,"Oakland, CA",Maintain analysis of data and metrics to identify areas for improvement and work to drive the solution in collaboration with other company business analysts and...
98 reviews,Data Analyst,Research Analyst,"San Francisco, CA","Research & Data Science*. The Research Analyst will be part of the Companies team, a division of Data Strategy...."
"6,038 reviews",Data Analyst,Entry Level Data and Operations Analyst,"Menlo Park, CA","Influencing business teams with data driven recommendations and. Plus-Ability to take raw data, and produce actionable insights...."
"4,180 reviews",Data Analyst,"Analyst, HR Reporting and Analytics","Dublin, CA",Perform complex data manipulation and aggregation of data from multiple HR data sources. HR Data Analytics. Develop simple to complex HR reports using data from...
,Data Analyst,Data Analyst,,"
Collaborate with Engineering, Product, Marketing, Finance and others, supporting business decisions with data, by producing and maintaining reports and..."
2 reviews,Data Analyst,Commissions Analyst,,"
We provide the most trusted app data and insights for your business to succeed in the app economy globally . You recognize the importance of data behind every..."
,Data Analyst,Data Scientist,,"
Over 2 years of experience in a Data Scientist role. Wrangle data and find solutions regardless of speed or scale — everything is in play, from memcache, to..."
4 reviews,Data Analyst,Data Analyst,,"
1+ year of work experience in data analysis; Provide statistics report and perform analysis of daily business data;..."
,Data Analyst,Data Engineer,,"
Data Architecture Design. In this role, your work will broadly influence the company's data consumers and analysts...."
,Data Analyst,Quantitative Research Analyst,,"
We are looking for an investments analyst to join our research and investment product team. You have a broad skill set, comfortable in analyzing globally..."
,Data Analyst,Data Scientist,,"
Work with multiple, complex data sources such as financial transactions, credit bureau reports, social media behavior, and e-commerce data at large scale...."
,Data Analyst,Data Analyst I,,"
Run monthly extracts out of Salesforce on Sales Operations quote data and Sales Compensation Order Data...."
2 reviews,Data Analyst,Search Analyst,,"
Experience handling large data sets and preparing data for testing and analysis. A love of data and attention to detail - highly organized and analytical...."
"6,046 reviews",Data Analyst,Business Analyst,,"
Details and provides requirements, data and use case analysis. Helps to elicit requirements using interviews, document analysis, requirements workshops, surveys..."
,Data Analyst,Customer Business Analyst,"Redwood City, CA",Customer Business Analyst. Experience or knowledge of NPD data is a plus. Demonstrated ability to integrate and synthesize information from multiple data...
,Data Analyst,Data Scientist,"Mountain View, CA","Easy to use and deploy, Arimo Data Intelligence Platform runs on existing Hadoop data stores, allowing businesses to begin generating value from big data within..."
31 reviews,Data Analyst,Segmentation Analyst - Marketing Analytics,"San Francisco, CA","Keep a constant eye out for potential improvements in analytics processes, data quality and data sources/tools...."
,Data Analyst,Data Scientist,"Mountain View, CA","A Data Scientist will. Familiar with data structures, parallelism and concurrency. At TOTVS Labs we are building a platform that combines data with AI...."
,Data Analyst,Database Analyst,"San Francisco, CA",Our production voice network is spread between 10 strategic locations in 5 different countries. You will also assist in extracting and analysing key data from...
"3,509 reviews",Data Analyst,Health Data Analyst IV Risk Adjustment,"Oakland, CA","Trains and coaches less-experienced healthcare data analysts on data retrieval techniques, programming practices, and statistical analysis and data..."
101 reviews,Data Analyst,Strategic Insights Analyst - Recruiting,,"
We are looking for a Data Analyst for the People Insights & Operations team, someone who gets excited about using data insights to drive business decisions at..."
"1,520 reviews",Data Analyst,Financial Analyst,,"
Analyze current and past financial data and performance. Prepare reports and projections based on analyses and compilations of different data sources...."
2 reviews,Data Analyst,Growth Analyst,,"
Opendoor’s Growth Analyst is a mix of data analytics as well as strategy & planning. As a Growth Analyst you will:...."
124 reviews,Data Analyst,Analyst - Marketing Cloud Sales Strategy and Operations,,"
Analyst – Marketing Cloud Sales Strategy and Operations. The Analyst will play a critical role in the Marketing Cloud Sales Strategy and Operations team...."
13 reviews,Data Analyst,Product Analyst,,"
Fluency with data, analytics and visualization technologies (SQL, Tableau). Act as an advocate of data driven culture at our company:...."
"9,969 reviews",Data Analyst,Business Analyst,,"
Basic hands on data analysis skills - ability to query existing data stores and use analytical tools to support requirements, decisions, and recommendations...."
,Data Analyst,Global Pricing Intelligence & Analytics Analyst,,"
Perform data analysis to enrich data sources and increase the quality of information received. As a member of the Global Strategy & Pricing Team, you will..."
"2,307 reviews",Data Analyst,Marketing & Sales Measurement & Data Analyst,,"
Analyzing data for data source systems; Supporting data capture, update, usage and other core business processes that influence data life-cycle;..."
