reviews,search_term,title,location,summary
"1,090 reviews",Data Analyst,"Scaled Abuse Analyst, YouTube",,"
Experience collecting, managing and synthesizing large data sets and information from disparate sources, statistical modeling, data mining and data analysis...."
101 reviews,Data Analyst,"Analyst - Strategic Finance, Growth Finance",,"
Partner closely with our Finance Data Science team (but literally, they’re actual scientists) to develop new methods of forecasting Uber’s exponential growth, 2..."
9 reviews,Data Analyst,Senior Helpdesk Analyst,,"
Firm understanding of data governance, data protection/encryption. As a Senior Helpdesk Analyst, you will be responsible for the day-to-day success of our team..."
8 reviews,Data Analyst,Technical Writer/Business Process Analyst (Must Obtain Secre...,,"
Truestone delivers complex systems and networks services that facilitate military and federal civilian agency operations. Our teams have worked on every U.S."
,Data Analyst,Analytical Biologist,,"
Demonstrated expertise in data analysis and visualization. Working knowledge of current statistical techniques in data analysis and clinical research...."
,Data Analyst,HR Processing Analyst 7234-386833m,,"
HR Processing Analyst. The HR Processing analyst will ensure accurate and timely data entry to meet various deadlines...."
387 reviews,Data Analyst,Facilities Budget Analyst (6108),,"
Facilities Budget Analyst. Eligible and qualified on-campus applicants, currently in bargaining units 2, 5, 7, and 9 are given hiring preference...."
,Data Analyst,Business and Media Analyst,"San Francisco, CA",Analyze media and response data looking for ways to optimize. Investigate all data and response anomalies by working with key members of the acquisition team....
54 reviews,Data Analyst,Epic Ambulatory Analyst,"Walnut Creek, CA",Works on problems of moderate scope where analysis of situations or data requires a review of a variety of factors. Purpose of Role....
,Data Analyst,Programmer Analyst I .NET - 0-4 yrs exp. W2 ONLY,"San Francisco, CA",Programmer Analyst I .NET. Experience with data access technologies. 4471323 Programmer Analyst I .NET - 11 Month Contract....
7 reviews,Data Analyst,"AVP, Sr. Management of Quantitative Analytics","San Francisco, CA","Knowledge/experience in Bloomberg terminal and data a plus. Demonstrated knowledge of and experience using a wide range of analytic systems , data bases and..."
4 reviews,Data Analyst,Data Analyst (Banking),"Redwood City, CA","Understanding of relational database and data integration tools. Provides analysis and input on data compiled, as appropriate...."
"13,124 reviews",Data Analyst,Financial Analyst (macys.com),,"
Maintain and publish various sales reports (while ensuring integrity and consistency of data). The analyst will also support ad hoc analytical needs due to the..."
101 reviews,Data Analyst,Growth Planning Analyst,,"
The Growth Planning Analyst role will provide our team the analytical horsepower necessary to understand the relevant trends and optimize our acquisition and..."
15 reviews,Data Analyst,Payroll Analyst,,"
Data entry including new hires, terms, bonus commissions, LOAs, payroll calculations, deductions and garnishments...."
710 reviews,Data Analyst,Business Systems Analyst - Pottery Barn Brands,,"
Strong proficiency in Excel, MS Access and SQL Data Mining. Data centric, but equally knowledgeable of the impact of qualitative benefits...."
8 reviews,Data Analyst,FP&A Analyst,,"
Must be comfortable working with large data sets. As a Financial Analyst, you’ll have a rare opportunity to contribute directly to the growth of a disruptive,..."
,Data Analyst,Billing Analyst,,"
Perform data gathering and validation in preparation for Tolling analysts to begin processing of invoices Analyze and troubleshoot issues/ reconcile payments...."
861 reviews,Data Analyst,Data Scientist,,"
BS in computer science MS in computer science Ability to provide statistical solutions and machine learning Algos for CE and qPCR instruments and"
,Data Analyst,Data Scientist,,"
Collaborate with the data engineering team to expand data coverage, compute new metrics, and continually improve the quality of data collection and analysis...."
5 reviews,Data Analyst,Data Scientist,,"
Build and centralize data science workflows. 2+ years of experience driving data science products. As a Data Scientist, you will play a key role in building out..."
10 reviews,Data Analyst,Risk Analyst,,"
Data collection and analysis in building reinsurance submission for client assignments. The Risk Analyst provides support to all account team members and..."
,Data Analyst,Senior Consultant,"San Francisco, CA","Gather and analyse data; Oversee input from analysts, senior analysts and associates to ensure project is delivered to time and budget...."
,Data Analyst,Senior Energy Data Analyst,"Oakland, CA",The Senior Energy Data Analyst will apply data mining and statistical analysis expertise to sophisticated energy data analysis....
"3,509 reviews",Data Analyst,Business Analyst,"Oakland, CA",Data / reporting application knowledge for the purpose of aggregating data and converting data into usable formats and patterns....
,Data Analyst,Technical Business Analyst,"Fremont, CA","Technical Business Analyst*. Methodology development and data modeling:. The technical business analyst collects, documents, and maintains the authoritative..."
"6,038 reviews",Data Analyst,Entry Level Data and Operations Analyst,"Menlo Park, CA","Influencing business teams with data driven recommendations and. Plus-Ability to take raw data, and produce actionable insights...."
,Data Analyst,Temporary Data Analyst - Beverage Alcohol Industry,,"
TradePulse is looking for a Temporary (6-8 Month) Data Analyst that can learn and grow within the production team...."
101 reviews,Data Analyst,Compensation Analyst,,"
EXPERIENCE2 - 5 years of experience in a professional, fast-paced environment. Uber is searching for a Compensation Analyst to support our rapidly growing..."
4 reviews,Data Analyst,Budget Analyst,,"
Provides support for the Finance Director and assists with special studies that require data compilation;..."
,Data Analyst,Growth Analyst,,"
We are seeking a talented growth analyst who thrives at the intersection of data, product, engineering, and marketing...."
,Data Analyst,Demand Planning Analyst,,"
Demand Planning Analyst. 3-5 years’ experience as a demand analyst. You understand the power of new trends and data points!..."
,Data Analyst,Operations Analyst III 7236-389438i,,"
Operations Analyst III. Covers MGBS Report Writing Analyst as needed. Assuring quality review of data and trouble-shooting errors...."
,Data Analyst,Sr. QA Tester,,"
Data Warehouse Testing*. Proficient in the analysis of data requirements, data models, and source to target mappings*...."
,Data Analyst,Health Data Research Analyst,,"
The Health Data Research Analyst serves as an organizational data expert supporting projects that require analysis of client outcome data...."
,Data Analyst,Data Engineer,,"
Previous experience as a Data engineer or Data Analyst. Think lots of data. Currently they are looking to expand their Data Science and Analytics team by hiring..."
508 reviews,Data Analyst,Digital Analyst,,"
To accomplish this, the analyst is comfortable with off-the-shelf web analytics packages, directly querying in SQL against the data warehouse, and using..."
,Data Analyst,Database Analyst,"San Francisco, CA",Our production voice network is spread between 10 strategic locations in 5 different countries. You will also assist in extracting and analysing key data from...
,Data Analyst,LiDAR Analyst,"Lafayette, CA","LiDAR Analyst, LiDAR Technician:. The candidate must possess a strong background in LiDAR data processing and have excellent analytical skills...."
,Data Analyst,Data Analyst - Pharma/Biotech W2 ONLY,"San Francisco, CA",Data Analyst - Pharma/Biotech W2 ONLY 12 Month Contract. Validate and model data from internal and external sources in support of Strategic Business Analysts...
"12,807 reviews",Data Analyst,Business Initiatives Cnsltnt 3,"San Francisco, CA","Data enablement strategies, digital documentation management, digital financial technologies. The Business Initiatives Consultant 3 will be a program manager..."
3 reviews,Data Analyst,Data Scientist,"Redwood City, CA","5+ years of work experience, preferably as data scientist or in highly analytical role. Work closely with product managers and analysts to understand key..."
,Data Analyst,IT R&D Operations Analyst,"Sunnyvale, CA","Model data using MS Excel, SQL, Oracle and/or other data warehouse analytical tools. Experience with data migration, strong understanding of data integrity from..."
,Data Analyst,Data Scientist,,"
Familiarity with data warehouses/large datasets, data visualization, or gaming/e-commerce analytics. Create reusable queries and data pipelines to automate..."
3 reviews,Data Analyst,Data QA Analyst,,"
We're looking for a Data QA Analyst to help build our next generation of analytics tools and manage our data pipeline of complex operational data...."
,Data Analyst,Data Scientist (Machine Learning),,"
Machine Learning Developer Brisbane, CA Sign on bonus Stocks! Up to 10% bonuses $110-180k depending on experience Fast growing social media company is"
11 reviews,Data Analyst,Data Warehouse Engineer,,"
You ""get"" data:. To that end, you must work closely with stakeholders on the data demand side (analysts and data scientists) and the data supply side (domain..."
17 reviews,Data Analyst,- SFUSD IT Business Analyst,,"
Analyze data processing needs; May perform data normalization tasks; The lS Business Analyst is the journey level in the Business Analyst series...."
"13,124 reviews",Data Analyst,"Business Systems Analyst, Marketing Systems (macys.com)",,"
Basic understanding of SQL queries, data models, data warehouse and data mart concepts. Identify data sources and data required for successful execution...."
,Data Analyst,Billing Analyst,,"
Perform data gathering and validation in preparation for Tolling analysts to begin processing of invoices Analyze and troubleshoot issues/ reconcile payments...."
47 reviews,Data Analyst,Online Banking Analyst,,"
Bank Secrecy Act, USA PATRIOT Act, etc.), 2) adhering to Bank policies and procedures, 3) completing required training, 4) identifying and reporting potential..."
16 reviews,Data Analyst,Analyst,,"
Knowledge of basic statistical analysis of data from the US Census Bureau, the data. Provide support in analyzing data and making JCATS system improvements for...."
21 reviews,Data Analyst,Senior Marketing Analyst,,"
Interest in and experience with data analytics; Executes ad hoc analyses and reports, translating data into story / insights...."
,Data Analyst,Data Scientist,"Mountain View, CA","Easy to use and deploy, Arimo Data Intelligence Platform runs on existing Hadoop data stores, allowing businesses to begin generating value from big data within..."
127 reviews,Data Analyst,Data Scientist,"San Francisco, CA",As a Data Scientist at Indeed your role is to follow the data. Can fish for data:. How A Data Scientist Works. Can do small data modeling work:....
"3,781 reviews",Data Analyst,Revenue Cycle Optimization Manager - Telecommute,"San Francisco, CA","Travel, Consultant, Healthcare Consultant, Project Manager, Big 5, Program Management, Health care, Provider, Payer, Eden Prairie, MN, telecommute, telecommuter..."
310 reviews,Data Analyst,Data Scientist (Epidemiology & Health Economics Focus),"Pleasanton, CA","Develops analysis specifications in partnership with Data Analysts. Good understanding of research and commercial real-world data sources, national and regional..."
,Data Analyst,Project Controls Governance Analyst - W2 Only,"San Francisco, CA","4597331 Governance Analyst - W2 ONLY 3 Year Contract. Minimum 5 years of related analytical, business and operational experience in Procurement/ Quantity..."
,Data Analyst,Digital Business Analyst,,"
Digital Business Analyst Loc:. Output varying from user stories, business processes, data mapping, and functional descriptions and flows...."
119 reviews,Data Analyst,Data Quality Analyst,,"
The Data Analyst will support the Director of Data Analytics leading and performing complex data analytics that will drive improved business performance...."
,Data Analyst,Financial Analyst,,"
We are seeking a Financial Analyst to be based in our San Francisco office. Knowledge of Power Pivot, Power Query, databases and data models is a plus...."
"1,318 reviews",Data Analyst,Program Analyst,,"
The Program Analyst primary duties include the following:. Supports the collection, analysis, evaluation and report data related to the effectiveness of..."
16 reviews,Data Analyst,Data Scientist,,"
High skill in data visualization (big plus). We want you to innovate our algorithms and better grok the data, leveraging every bit of our data and pioneer..."
,Data Analyst,Business Systems Analyst,,"
Business Systems Analyst. Degree and minimum of 5 years of systems analyst experience across a variety of business functions and domains...."
,Data Analyst,Risk/Compliance Analyst,,"
Taos is immediately hiring a Risk/Compliance Analyst for a cutting edge tech company in the Bay Area! THIS IS NOT A REMOTE OPPORTUNITY / NO THIRD PARTY VENDORS...."
3 reviews,Data Analyst,Data Analyst,,"
Standardize data naming, data definitions and modeling. Demonstrated experience with data models and data mapping...."
264 reviews,Data Analyst,"Analyst, Visa Performance Solutions Job",,"
Analyst, Visa Performance Solutions. Responsible for completing detailed analysis on client data and identifying preliminary trends and themes in the data...."
,Data Analyst,ECO/ECN Change Analyst,,"
At Fitbit, our mission is to help people lead healthier, more active lives by empowering them with data, inspiration and guidance to reach their goals...."
119 reviews,Data Analyst,Data Quality Analyst,"Novato, CA",The Data Analyst will support the Director of Data Analytics leading and performing complex data analytics that will drive improved business performance....
,Data Analyst,Customer Business Analyst,"Redwood City, CA",Customer Business Analyst. Experience or knowledge of NPD data is a plus. Demonstrated ability to integrate and synthesize information from multiple data...
55 reviews,Data Analyst,Web Analyst,"San Francisco, CA",Web Analyst Location:. Work with survey management team to implement surveys Report and analyze survey data Build dashboards in Tableau or Excel to easily...
,Data Analyst,Principal Data Scientist - CyberSecurity - SF,"San Francisco, CA","Data Science, Python, R, multi-dimensional data sets, Statistical modeling, Machine Learning:. Experience with multi-dimensional data sets...."
,Data Analyst,IT R&D Lab Analyst,"Sunnyvale, CA","Strong knowledge of information systems & workflows for lab assay data & knowledge management, data query & analysis, lab automation & LIMS, sample management,..."
,Data Analyst,"Analyst, Origination & Structuring",,"
Conduct primary and secondary research on energy policies, power economics, competitive market pricing and other data by market...."
,Data Analyst,Growth Marketing Analyst,,"
As a GearLaunch Growth Marketing Analyst, you will have the exciting opportunity to create unique merchandise and drive sales using cutting edge marketing..."
,Data Analyst,Data Analyst-Merchandising/Consumer Brand,,"
4+ years of data analytics experience, retail industry preferred. The ideal candidate has prior consumer brand market share analysis experience, familiarity..."
53 reviews,Data Analyst,"Senior Data Analyst, Product",,"
ETL and data pipeline development experience. The ability to retrieve data using SQL, HiveQL, Python or other scripting languages...."
,Data Analyst,Principal Modeling Analyst / Data Scientist,,"
4+ years experience in model development, predictive analytics or data science. True passion for leading, inspiring, and mentoring data scientists of all levels..."
,Data Analyst,Financial Analyst,,"
CPA license -Previous experience running reports, data extraction, querying and other information gathering. BA/BS in Information Systems, Accounting, Finance,..."
7 reviews,Data Analyst,Variable Data Print Programmer,,"
The purpose of the Data Analyst role is to provide a range of data skills to support the development and growth of the HH Data Department, to carry out day-to..."
,Data Analyst,Supply chain analyst- entry level,,"
Supply chain analyst:. Data extraction and manipulation to evaluate programs. Seeking a Supply Chain Analyst for an immediate project...."
"1,222 reviews",Data Analyst,Configuration Management Database / Reporting Analyst Job,,"
Configuration Management Database / Reporting Analyst (Job Number:. Minimum 2 years’ experience performing business and statistical analysis on variety of data..."
65 reviews,Data Analyst,Research Data Programmer/Analyst,,"
Managing and servicing UCSF customer requests for DPH derived data (both reports and data extracts) from the Data Repository (IDR)...."
"4,180 reviews",Data Analyst,"Analyst, HR Reporting and Analytics","Dublin, CA",Perform complex data manipulation and aggregation of data from multiple HR data sources. HR Data Analytics. Develop simple to complex HR reports using data from...
,Data Analyst,Manager - Data Analytics and IT Audit,"San Francisco Bay Area, CA",You will be a bridge between the Audit Team and the more specialized Data Analysts. You will leverage your dual background in Audit and Data Analytics to liaise...
31 reviews,Data Analyst,Segmentation Analyst - Marketing Analytics,,"
Keep a constant eye out for potential improvements in analytics processes, data quality and data sources/tools...."
,Data Analyst,Data Scientist Engineering - All Levels,,"
Hands on model building, application, instrumentation, data science engineering position. Apply domain expertise to find latent features within our data sets...."
24 reviews,Data Analyst,Healthcare Analytic Intern,,"
Analyze historical healthcare utilization and cost data to improve the profitability of a product. Graduate level student in public health, business..."
124 reviews,Data Analyst,Technology Sourcing Analyst,,"
Data and Analytics:. Contract negotiations, performing market analysis, provide spend data insights and recommendations, and develop business case for new..."
4 reviews,Data Analyst,Data Scientist - Statistician,,"
Passion for Data / Mathematics / Statistics. We’re a tight-knit, super-ambitious team in San Francisco looking for a Data Scientist - Statistician that can help..."
,Data Analyst,Business data analyst,,"
Minimum 5 years of experience as a BSA/data analyst. Experience with source-to-target mapping, working with data models and extensive data analysis using SQL...."
247 reviews,Data Analyst,"Business Analyst, Advisory Board & Speaker Bureau Services",,"
The Business Analyst serves as the department’s program manager for the Event Data Management solution. The ABS/SBS Business Analyst will be expected to:...."
,Data Analyst,Credit Analyst,,"
Tasks would include various administrative and analyst functions including but not limited to data entry, review of personal financials, following up on..."
5 reviews,Data Analyst,Trading Quality Control Analyst,,"
Experience with standard market data platforms (Bloomberg, Thomson, etc.). The Trading Quality Control Analyst is responsible for daily audit, review, and..."
,Data Analyst,Client Services Analyst,,"
You must also have the ability to use data to support assumptions, create compelling “stories” and drive business conversations...."
,Data Analyst,Outcome-Driven Innovation Market Research Analyst,"San Francisco, CA",The ODI Research Analyst is an important role on our client project teams; Strategyn is seeking an experienced Research Analyst to conduct our outcome-based...
,Data Analyst,Clinical Director - Applied Behavior Analysis,"San Leandro, CA","Board Certified Behavior Analyst:. \*Applicants must have knowledge of Natural Environment and Discrete Trial teaching, direct observation data collection..."
11 reviews,Data Analyst,Data Scientist,"Santa Clara, CA",Writing or modifying data pipelines to process and mine historical Surveyor data. Experience dealing with large amounts of unstructured data (experience with...
127 reviews,Data Analyst,Data Scientist,"San Francisco, CA",As a Data Scientist at Indeed your role is to follow the data. Can fish for data:. How A Data Scientist Works. Can do small data modeling work:....
,Data Analyst,Data Analyst / Data Mapper with Excel,"San Rafael, CA","Extract data from SQL, load data using PL/SQL *. Experience with Enterprise Data *. Data Mapper/Analyst - Advanced Excel Duration:...."
"3,509 reviews",Data Analyst,Financial Analyst,,"
Prepares more complex financial trend and data analysis reports. May be accountable for the coordination, compilation and distribution of financial data...."
23 reviews,Data Analyst,Business Analyst (rev 041816),,"
Identify opportunities to enhance data acquisition, processing and delivery processes. Manage data acquisition, quality assurance and analytic delivery for..."
,Data Analyst,Business Systems Analyst,,"
Data and data management requirements for SAC’s data processes and systems. 3+ years requirements development experience directly related to software..."
4 reviews,Data Analyst,Data Analyst (Banking),,"
Understanding of relational database and data integration tools. Provides analysis and input on data compiled, as appropriate...."
,Data Analyst,Customer Support - Business Process Analyst,,"
Customer Support - Business Process Analyst. Our Process Analysts measure the quality of customer service through case audits...."
,Data Analyst,Firmware Data Scientist,,"
Passion for data and data mining. Mine field data generated by Fitbit devices. Design, develop and build scripts to automate data processing...."
,Data Analyst,Medical Analyst,,"
We are looking for a medical data analyst who is strong in science, clinical terms, and data analysis. Clinical Data coordinator:...."
"3,509 reviews",Data Analyst,Contract Operations Analyst,,"
Conducts data and systems analyses to support the business functions of Community Medical Services. Serves as Division-wide resource for issues and questions..."
17 reviews,Data Analyst,Data Protection Engineer,,"
Significant hands on experience as a primary engineer implementing, supporting and optimizing an enterprise-wide distributed CommVault version 10+..."
,Data Analyst,Data Scientist,,"
SigFig is searching for a curious, driven, and skillful data scientist to drive change and fuel the performance of the company. What you'll be doing:...."
13 reviews,Data Analyst,"VP, Decision Science","San Francisco, CA","Combine disparate data sets (customer database, marketing behavior, macro-economic data, etc.). Decision Sciences is charged with bringing actionable and..."
4 reviews,Data Analyst,Conflicts Analyst,"San Francisco, CA",Searches and analyzing results for data to be included. Large law firm in San Francisco is looking for a stellar conflicts analyst....
96 reviews,Data Analyst,"Business Analyst Job in San Francisco, CA","San Francisco, CA","Business Analyst Experience (7+ years). The Business Analyst is responsible for conducting customer needs analysis, developing detail product and internet..."
31 reviews,Data Analyst,Segmentation Analyst - Marketing Analytics,"San Francisco, CA","Keep a constant eye out for potential improvements in analytics processes, data quality and data sources/tools...."
44 reviews,Data Analyst,Quantitative Analyst,"San Francisco, CA",Experience with Big Data tools such as Hive/Presto. 3-5 years of experience working with data and performing analysis....
,Data Analyst,Analytics Engineer,,"
Collaborate with analyst team and software architect to manage and synchronize data systems. Strong interest and experience in analyzing data;..."
12 reviews,Data Analyst,Provider Enrollment Analyst,,"
The Analyst role is an exciting opportunity on an evolving team with new challenges arising daily with a high level of data integrity...."
,Data Analyst,Data Scientist,,"
An in-depth understanding of algorithms, data structures, machine learning, numerical methods, probability theory, information retrieval based approaches,..."
213 reviews,Data Analyst,(Retail)CRM Analyst,,"
3 to 5 years prior experience producing data driven insights that drive results, retail experience a strong plus...."
12 reviews,Data Analyst,Payer Contract Analyst,,"
Data and Project Management (20%). Provides accurate contract data to billing agents. Performs complex or high level data analysis, as assigned...."
61 reviews,Data Analyst,"Business Intelligence Analyst, IT",,"
In data warehousing (OBIEE preferred) and can design and build data. Modeling and data integration strategy...."
54 reviews,Data Analyst,Benefits Analyst,,"
Interprets census data and evaluates it for accuracy. We are seeking a talented Benefits Analyst to join the Employee Benefits team in our San Ramon office...."
,Data Analyst,"Business Intelligence Analyst, IT",,"
In data warehousing (OBIEE preferred) and can design and build data. Modeling and data integration strategy...."
,Data Analyst,Business Analyst,,"
Enterprise Data Warehouse or Master Data Management Project Experience. The end goal is to remediate replica data and find one single way to identify a customer..."
4 reviews,Data Analyst,Billing Analyst - Part Time,,"
Scrub raw data by converting currencies to USD and performing pivots and v-lookups to create master spreadsheet...."
